<?xml version="1.0" encoding="utf-8" ?>
<KeybindMap xmlns="http://arctisaurora/AuroraInputTypes"
		  xmlns:xsi="http://www.w3.org/2001/XMLSchema-instance"
		  xsi:schemaLocation="http://arctisaurora/AuroraInputTypes ../../Schemas/InputTypeSchema.xsd" >
	<NamedModifier Modifier="Extend" Key="LeftShift" />
	<NamedModifier Modifier="Extend" Key="RightShift" />

	<Keybind Trigger="Backspace" Action="ExitApplication">
		<Modifier Key="LeftControl" />
		<Press />
	</Keybind>

	<Keybind Trigger="AnySymbol" Action="Text.Write">
		<Continuous />
	</Keybind>

	<Keybind Trigger="Backspace" Action="Text.Backspace">
		<Repeat />
	</Keybind>

	<Keybind Trigger="Delete" Action="Text.Delete">
		<Repeat />
	</Keybind>

	<Keybind Trigger="Enter" Action="Text.NewBlock">
		<Repeat />
	</Keybind>

	<Keybind Trigger="Escape" Action="Text.Cancel">
		<Press />
	</Keybind>

	<Keybind Trigger="S" Action="Text.Save">
		<Modifier Key="LeftControl" />
		<Press />
	</Keybind>

	<Keybind Trigger="Z" Action="Text.Undo">
		<Modifier Key="LeftControl" />
		<Press />
	</Keybind>

	<Keybind Trigger="Y" Action="Text.Redo">
		<Modifier Key="LeftControl" />
		<Press />
	</Keybind>

	<Keybind Trigger="Left" Action="Text.CaretLeft">
		<Repeat />
	</Keybind>

	<Keybind Trigger="Right" Action="Text.CaretRight">
		<Repeat />
	</Keybind>

	<Keybind Trigger="Up" Action="Text.CaretUp">
		<Repeat />
	</Keybind>

	<Keybind Trigger="Down" Action="Text.CaretDown">
		<Repeat />
	</Keybind>

	<Keybind Trigger="Home" Action="Text.CaretLineStart">
		<Press />
	</Keybind>

	<Keybind Trigger="End" Action="Text.CaretLineEnd">
		<Press />
	</Keybind>

	<Keybind Trigger="PageUp" Action="Text.CaretPageUp">
		<Repeat />
	</Keybind>

	<Keybind Trigger="PageDown" Action="Text.CaretPageDown">
		<Repeat />
	</Keybind>

	<!-- the two-modifier bind is declared first: IsShadowed only suppresses the looser bind once the
	     stricter one has already fired this pass -->
	<Keybind Trigger="Backslash" Action="View.SplitDown">
		<Modifier Key="LeftControl" />
		<Modifier Key="LeftShift" />
		<Press />
	</Keybind>

	<Keybind Trigger="Backslash" Action="View.SplitRight">
		<Modifier Key="LeftControl" />
		<Press />
	</Keybind>

</KeybindMap>